SL No,Route No,Route Description,Distance (km),Base Fare (2.12/km),Toll (70% Load),Total Fare (BDT),Collectable Fare  (BDT)
1,107,"Barishal-Khulna via Madaripur, Faridpur, Jhenaidah, Jashore",308,832.52,10.36,842.88,840
2,108,"Pirojpur-Benapole via Bagerhat, Khulna, Jashore",151,408.15,16.6,424.75,425
3,109,"Barishal-Jashore via Jhalokathi, Pirojpur, Bagerhat, Khulna",164,443.29,10.36,453.65,455
4,110,"Barishal-Benapole via Jhalokathi, Pirojpur, Bagerhat, Khulna, Jashore",203,548.71,23.57,572.28,570
5,111,"Barishal-Kushtia via Faridpur, Magura, Jhenaidah",252,681.16,10.36,691.52,690
6,112,"Khulna-Rajshahi via Jashore, Jhenaidah, Kushtia, Lalon Shah Bridge, Natore",273,737.92,7.68,745.6,745
7,113,"Khulna-Bogura via Jashore, Jhenaidah, Kushtia, Lalon Shah Bridge, Natore",295,797.39,8.75,806.14,805
8,114,"Khulna-Rangpur via Jashore, Jhenaidah, Kushtia, Lalon Shah Bridge, Natore, Bogura",406,1097.42,8.75,1106.17,1105
9,115,"Patuakhali-Khulna via Barishal, Madaripur, Faridpur, Magura, Jashore",316,854.15,30.71,884.86,885
10,116,"Barishal-Meherpur via Madaripur, Faridpur, Rajbari, Kushtia",276,746.03,10.36,756.39,755
11,117,"Faridpur-Benapole via Magura, Arpara, Jashore",132,356.8,3.21,360.01,360
12,118,"Cumilla-Sylhet via Brahmanbaria, Moulvibazar",258,697.37,4.82,702.19,700
13,119,"Chattogram-Benapole via Feni, Cumilla, Dhaka, Paturia, Jashore",497,1343.39,109.28,1452.67,1450
14,120,"Khulna-Pabna via Jashore, Jhenaidah, Kushtia, Lalon Shah Bridge",207,559.52,7.68,567.2,565
15,121,"Pirojpur-Rajshahi via Barishal, Faridpur, Kushtia, Lalon Shah Bridge",348,940.64,25.0,965.64,965
16,122,"Khulna-Chapainawabganj via Jashore, Jhenaidah, Kushtia, Lalon Shah Bridge, Rajshahi",318,859.55,7.68,867.23,865
17,123,"Rajshahi-Jashore via Lalon Shah Bridge, Kushtia, Jhenaidah",213,575.74,7.68,583.42,580
18,124,"Sirajganj-Meherpur via Pabna, Lalon Shah Bridge, Kushtia",221,597.36,7.68,605.04,605
19,125,"Kushtia-Bogura via Lalon Shah Bridge, Natore",144,389.23,8.75,397.98,400
20,126,"Cumilla-Mymensingh via Brahmanbaria, Bhairab, Kishoreganj",239,646.02,9.28,655.3,655
21,127,"Cox's Bazar-Benapole via Chattogram, Dhaka, Paturia, Jashore",645,1743.44,114.82,1858.26,1855
22,128,"Mymensingh-Rajshahi via Jamuna Bridge, Natore",239,646.02,37.5,683.52,685
23,129,"Bogura-Sylhet via Jamuna Bridge, Dhaka, Bhairab, Moulvibazar",463,1251.49,46.6,1298.09,1295
24,130,"Mymensingh-Khulna via Jamuna Bridge, Pabna, Kushtia, Jashore",423,1143.37,43.39,1186.76,1185
25,131,"Chattogram-Rangpur via Dhaka, Jamuna Bridge, Bogura",544,1470.43,51.78,1522.21,1520
26,132,"Mymensingh-Sylhet via Kishoreganj, Bhairab, Moulvibazar",309,835.23,13.05,848.28,845
27,134,"Cumilla-Jamalpur via Brahmanbaria, Bhairab, Mymensingh",287,775.76,9.28,785.04,785
28,135,"Cumilla-Sunamganj via Brahmanbaria, Moulvibazar, Sylhet",308,832.52,4.82,837.34,835
29,136,"Cumilla-Beani Bazar via Brahmanbaria, Moulvibazar",258,697.37,0.0,697.37,700
30,137,"Tangail-Maijdee via Dhaka, Cumilla, Feni",281,759.54,16.07,775.61,775
31,139,"Tangail-Kushtia via Jamuna Bridge, Nalka, Pabna",198,535.19,43.39,578.58,580
32,141,"Dinajpur-Khulna via Bogura, Lalon Shah Bridge, Jashore",434,1173.1,8.75,1181.85,1180
33,142,"Thakurgaon-Faridpur via Bogura, Lalon Shah Bridge, Rajbari",434,1173.1,11.96,1185.06,1185
34,143,"Rajshahi-Barishal via Lalon Shah Bridge, Faridpur",340,919.02,18.03,937.05,935
35,144,"Kurigram-Khulna via Bogura, Lalon Shah Bridge, Jashore",452,1221.76,8.75,1230.51,1230
36,145,"Meherpur-Patuakhali via Jhinaihah, Faridpur, Barishal",306,827.12,33.93,861.05,860
37,146,"Bogura-Barishal via Lalon Shah Bridge, Faridpur, Madaripur",362,978.49,19.11,997.6,995
38,148,"Chandpur-Sunamganj via Cumilla, Sylhet",396,1070.39,5.89,1076.28,1075
39,150,"Jashore-Rangpur via Lalon Shah Bridge, Natore, Bogura",347,937.94,8.75,946.69,945
40,151,"Khulna-Faridpur via Jashore, Jhenaidah, Magura",186,502.76,3.21,505.97,505
41,152,"Cox's Bazar-Barishal via Chattogram, Padma Bridge, Madaripur",553,1494.76,117.85,1612.61,1610
42,153,"Brahmanbaria-Mymensingh via Kishoreganj, Bhairab",156,421.67,9.28,430.95,430
43,154,"Bagerhat-Amtali via Pirojpur, Barishal, Patuakhali",140,378.42,14.1,392.52,395
44,162,"Khulna-Sirajganj via Lalon Shah Bridge, Bonpara",279,754.14,9.46,763.6,760
45,163,"Ishwardi-Mymensingh via Pabna, Nalka, Kalihati",242,654.13,35.71,689.84,690
46,164,"Kushtia-Panchagarh via Lalon Shah Bridge, Bogura, Rangpur",394,1064.98,8.75,1073.73,1070
47,165,"Rangpur-Sylhet via Jamuna Bridge, Dhaka, Bhairab",564,1524.49,49.46,1573.95,1570
48,167,"Teknaf-Benapole via Chattogram, Dhaka, Jashore",720,1946.16,114.82,2060.98,2060
49,168,"Dinajpur-Teknaf via Jamuna Bridge, Dhaka, Chattogram",844,2281.33,57.32,2338.65,2340
50,169,Brahmanbaria-Sylhet via Moulvibazar,175,473.03,3.75,476.78,475
51,170,"Chattogram-Khulna via Dhaka, Paturia, Jashore",517,1397.45,109.28,1506.73,1505
52,171,"Chattogram-Charfashion via Feni, Lakshmipur, Bhola",278,751.43,160.35,911.78,910
53,172,"Faridpur-Dinajpur via Kushtia, Lalon Shah Bridge, Bogura",377,1019.03,11.96,1030.99,1030
54,173,"Kushtia-Chapainawabganj via Lalon Shah Bridge, Rajshahi",167,451.4,7.67,459.07,460
55,180,"Tangail-Lakshmipur via Dhaka, Cumilla, Feni",303,819.01,16.07,835.08,835
56,181,"Gopalganj-Benapole via Magura, Jashore",235,635.21,3.21,638.42,635
57,182,"Dinajpur-Sylhet via Jamuna Bridge, Dhaka, Bhairab",650,1756.95,49.46,1806.41,1805
58,183,"Dinajpur-Chattogram via Jamuna Bridge, Dhaka, Cumilla",625,1689.38,51.78,1741.16,1740
59,186,"Cumilla-Kurigram via Dhaka, Jamuna Bridge, Rangpur",460,1243.38,51.78,1295.16,1295
60,188,"Jamalpur-Chattogram via Tangail, Dhaka, Cumilla",415,1121.75,16.07,1137.82,1135
61,189,"Kishoreganj-Sylhet via Bhairab, Moulvibazar",244,659.53,13.75,673.28,670
62,190,"Chattogram-Rajshahi via Dhaka, Jamuna Bridge, Natore",490,1324.47,53.92,1378.39,1375
63,191,"Meherpur-Pirojpur via Jashore, Khulna, Bagerhat",223,602.77,15.17,617.94,620
64,192,"Mymensingh-Dinajpur via Jamuna Bridge, Bogura",323,873.07,35.71,908.78,905
65,194,Magura-Muksudpur via Faridpur,97,262.19,3.21,265.4,265
66,196,"Panchagarh-Sylhet via Rangpur, Jamuna Bridge, Dhaka",709,1916.43,49.46,1965.89,1965
67,197,"Sylhet-Nilphamari via Dhaka, Jamuna Bridge, Rangpur",627,1694.78,49.46,1744.24,1740
68,225,"Mymensingh-Chattogram via Dhaka, Bhairab, Cumilla",460,1243.38,9.28,1252.66,1250
69,226,"Cox's Bazar-Khulna via Dhaka, Paturia, Jashore",665,1797.5,114.82,1912.32,1910
70,227,"Barishal-Khulna via Jhalokathi, Bagerhat",103,278.41,23.57,301.98,300
71,228,"Barishal-Khulna via Faridpur, Magura, Jashore",297,802.79,10.35,813.14,810
72,229,"Chattogram-Khulna via Chandpur, Shariatpur, Gopalganj",366,989.3,111.25,1100.55,1100
73,230,"Khulna-Teknaf via Dhaka, Cumilla, Chattogram",738,1994.81,114.82,2109.63,2110
74,231,"Kushtia-Sirajganj via Lalon Shah Bridge, Hatikumrul",133,359.5,9.46,368.96,370
75,232,"Faridpur-Rangpur via Kushtia, Lalon Shah Bridge, Bogura",345,932.54,11.96,944.5,940
76,233,"Rangpur-Barishal via Lalon Shah Bridge, Faridpur",465,1256.9,19.1,1276.0,1275
77,234,"Bagerhat-Bauphal via Barishal, Bakerganj",124,335.17,32.32,367.49,365
78,235,"Khulna-Sirajganj via Jashore, Kushtia, Lalon Shah Bridge",314,848.74,7.67,856.41,855
79,236,"Thakurgaon-Madaripur via Bogura, Lalon Shah Bridge, Faridpur",503,1359.61,11.96,1371.57,1370
80,237,"Rajshahi-Teknaf via Jamuna Bridge, Dhaka, Chattogram",721,1948.86,57.32,2006.18,2005
81,238,"Dinajpur-Kushtia via Bogura, Lalon Shah Bridge",282,762.25,8.75,771.0,770
82,239,"Thakurgaon-Kushtia via Bogura, Lalon Shah Bridge",341,921.72,8.75,930.47,930
83,240,"Bagerhat-Barguna via Barishal, Patuakhali",157,424.37,49.46,473.83,470
84,241,"Naogaon-Jashore via Bogura, Lalon Shah Bridge, Jhenaidah",284,767.65,8.75,776.4,775
85,242,Bagerhat-Patuakhali via Barishal,123,332.47,38.75,371.22,370
86,243,"Pirojpur-Lohagara via Khulna, Jashore, Narail",158,427.07,28.03,455.1,455
87,244,"Gopalganj-Benapole via Khulna, Jashore",147,397.34,8.39,405.73,405
88,245,"Mymensingh-Chattogram via Bhairab, Cumilla",368,994.7,9.28,1003.98,1000
89,246,"Pabna-Jashore via Lalon Shah Bridge, Jhenaidah",150,405.45,7.67,413.12,410
90,247,"Pabna-Mongla via Lalon Shah Bridge, Jashore, Khulna",254,686.56,14.28,700.84,700
91,248,"Mymensingh-Rangpur via Jamuna Bridge, Bogura",284,767.65,35.71,803.36,800
92,249,"Meherpur-Faridpur via Jhinaihah, Magura",145,391.94,3.21,395.15,395
93,250,"Meherpur-Faridpur via Chuadanga, Magura",143,386.53,3.21,389.74,390
94,251,"Meherpur-Faridpur via Kushtia, Rajbari",153,413.56,3.21,416.77,415
95,252,"Meherpur-Pabna via Kushtia, Lalon Shah Bridge",106,286.52,7.67,294.19,295
96,253,"Meherpur-Rangpur via Lalon Shah Bridge, Bogura",298,805.49,8.75,814.24,815
97,254,"Pabna-Barishal via Lalon Shah Bridge, Faridpur",277,748.73,18.03,766.76,765
98,255,"Khulna-Panchagarh via Lalon Shah Bridge, Rangpur",541,1462.32,8.75,1471.07,1470
99,256,"Kushtia-Rangpur via Lalon Shah Bridge, Bogura",253,683.86,8.75,692.61,690
100,257,"Kushtia-Naogaon via Lalon Shah Bridge, Rajshahi",193,521.68,8.75,530.43,530
101,258,"Kushtia-Rajshahi via Lalon Shah Bridge, Natore",124,335.17,7.67,342.84,340
102,259,"Kushtia-Gaibandha via Lalon Shah Bridge, Bogura",215,581.15,8.75,589.9,590
103,260,"Khulna-Barguna via Barishal, Patuakhali",184,497.35,28.03,525.38,525
104,261,"Rajshahi-Bagerhat via Lalon Shah Bridge, Khulna",307,829.82,16.07,845.89,845
105,262,"Rajshahi-Rajbari via Lalon Shah Bridge, Kushtia",188,508.16,10.89,519.05,520
